{
  "$comment": "GENERATED BY tools/schemagen — DO NOT HAND EDIT",
  "$id": "urn:nself:cli:schema:envelope:v1",
  "$schema": "https://json-schema.org/draft/2020-12/schema",
  "additionalProperties": false,
  "oneOf": [
    {
      "required": [
        "data"
      ]
    },
    {
      "required": [
        "error"
      ]
    }
  ],
  "properties": {
    "command": {
      "type": "string"
    },
    "data": true,
    "error": {
      "$ref": "urn:nself:cli:schema:error:v1"
    },
    "meta": {
      "additionalProperties": false,
      "properties": {
        "deprecations": {
          "items": {
            "additionalProperties": false,
            "properties": {
              "new": {
                "type": "string"
              },
              "old": {
                "type": "string"
              },
              "removal_at": {
                "type": "string"
              }
            },
            "required": [
              "old",
              "new",
              "removal_at"
            ],
            "type": "object"
          },
          "type": "array"
        },
        "warnings": {
          "items": {
            "type": "string"
          },
          "type": "array"
        }
      },
      "type": "object"
    },
    "schema_version": {
      "const": "1",
      "type": "string"
    }
  },
  "required": [
    "schema_version",
    "command"
  ],
  "type": "object"
}
